{
  "schema_version": "kyuubiki.operator-package-dynamic-smoke/v2",
  "generated_at": "2026-08-24T04:29:43Z",
  "ok": true,
  "package_id": "operator.template.summary",
  "operator_ids": [
    "extract.template_summary"
  ],
  "host_version": "2.15.0",
  "sdk_api_version": "kyuubiki.operator-sdk/v1",
  "template_manifest": "workers/rust/templates/operator-crate-template/Cargo.toml",
  "package_manifest": "workers/rust/templates/operator-crate-template/kyuubiki-operator.json",
  "preflight_report": "releases/usability-evidence/2.15.0/operator-package-dynamic-preflight.json",
  "dynamic_library": "workers/rust/templates/operator-crate-template/target/debug/libkyuubiki_operator_template.dylib",
  "stages": [
    {
      "id": "template_tests",
      "description": "Run template operator crate tests and descriptor readiness checks.",
      "cwd": ".",
      "command": [
        "cargo",
        "test",
        "--manifest-path",
        "workers/rust/templates/operator-crate-template/Cargo.toml",
        "--",
        "--nocapture"
      ],
      "status": 0,
      "ok": true
    },
    {
      "id": "strict_preflight",
      "description": "Run strict read-only package preflight with rejection and readiness-warning gates.",
      "cwd": "workers/rust",
      "command": [
        "cargo",
        "run",
        "-p",
        "kyuubiki-installer",
        "--",
        "operator-package-preflight",
        "templates",
        "--out",
        "../../releases/usability-evidence/2.15.0/operator-package-dynamic-preflight.json",
        "--fail-on-rejected",
        "--fail-on-readiness-warnings"
      ],
      "status": 0,
      "ok": true
    },
    {
      "id": "template_cdylib_build",
      "description": "Build the template operator dynamic library for host loading.",
      "cwd": ".",
      "command": [
        "cargo",
        "build",
        "--manifest-path",
        "workers/rust/templates/operator-crate-template/Cargo.toml"
      ],
      "status": 0,
      "ok": true
    },
    {
      "id": "engine_dynamic_host_load",
      "description": "Run the engine dynamic host test that loads and dispatches the template operator.",
      "cwd": "workers/rust",
      "command": [
        "cargo",
        "test",
        "-p",
        "kyuubiki-engine",
        "loads_prebuilt_template_cdylib_through_dynamic_host",
        "--",
        "--ignored",
        "--nocapture"
      ],
      "status": 0,
      "ok": true
    },
    {
      "id": "agent_dynamic_host_dispatch",
      "description": "Start a package-enabled Agent, execute through RPC, reject digest tamper, and recover.",
      "cwd": "workers/rust",
      "command": [
        "cargo",
        "test",
        "-p",
        "kyuubiki-cli",
        "--test",
        "operator_package_live",
        "--",
        "--ignored",
        "--nocapture"
      ],
      "status": 0,
      "ok": true
    }
  ]
}
